{
  "$schema": "./tools.schema.json",
  "toelichting": "Enige bron van waarheid voor de toolportefeuille van bouwman.tools. portal.html, beheer.html, access-beheer-worker.js en TOOLS.md horen hieruit te lezen of hieruit te worden gegenereerd; houd geen tweede lijst bij. Zie AGENTS.md.",
  "bijgewerkt": "2026-10-09",
  "statussen": {
    "live": "Zichtbaar in het portaal en bedoeld voor gebruik.",
    "beta": "Zichtbaar met bèta-tag; inhoudelijk nog niet vrijgegeven.",
    "verborgen": "Wel gepubliceerd en bereikbaar via een directe link, bewust niet in een menu.",
    "concept": "Nog niet gepubliceerd."
  },
  "afscherming": {
    "toelichting": "Een tool is alleen afgeschermd als er een Cloudflare Access-app aan hangt. Zonder access_app_id is het bestand voor iedereen met de URL bereikbaar en heeft het toekennen van rechten in beheer.html geen effect.",
    "account_id_vindplaats": "CF_ACCOUNT_ID in access-beheer-worker.js"
  },
  "eigenaarschap": {
    "toelichting": "Elke tool heeft een inhoudelijk verantwoordelijke: de eigenaar beoordeelt of de tool vakinhoudelijk juist is en accordeert wijzigingen. De eigenaar krijgt bij iedere publicatie een vrijgavenotitie met de wijzigingen, de geraakte fiscale waarden met vindplaats en de uitslag van de testset. Zolang de eigenaar niet is vastgelegd staat hier 'tbd'; de tool blijft dan gewoon live, check_tools.py meldt de achterstand.",
    "ritmes": {
      "belastingplan": "Opnieuw beoordelen voor 1 januari, zodra de waarden voor het nieuwe jaar definitief zijn. Geldt voor tools met jaargebonden waarden.",
      "jaarlijks": "Eens per jaar opnieuw beoordelen.",
      "geen": "Geen periodieke beoordeling; alleen bij wijziging."
    }
  },
  "categorievolgorde": [
    "BV & DGA",
    "Auto & Mobiliteit",
    "Loonheffing & WKR",
    "Accountancy & Jaarrekening",
    "BTW & Omzetbelasting",
    "Belastingdienst",
    "Administratie & Archief",
    "Arbeidsrecht & Compliance",
    "Financiële planning",
    "Vastgoed",
    "Kantoor",
    "Overig"
  ],
  "portaalworkers": [
    {
      "naam": "access-beheer",
      "waarvoor": "Draagt het toegangsbeheer: portal.html haalt hier de rechten van de aangemelde gebruiker op, beheer.html kent ze toe, en de dagelijkse controle om 06:00 UTC draait erin. Hangt aan geen enkele tool en zou zonder deze regel als ongebruikt worden gemeld."
    }
  ],
  "tools": [
    {
      "id": "bv-janee",
      "naam": "BV Ja/Nee",
      "beschrijving": "Rekent door of een klant belastingtechnisch beter af is met een BV dan als eenmanszaak",
      "bestand": "bv_janee_DK.html",
      "categorie": "BV & DGA",
      "icon": "🏢",
      "tags": [
        {
          "label": "BV"
        },
        {
          "label": "Lokaal",
          "soort": "privacy-local"
        }
      ],
      "status": "live",
      "status_reden": "Live sinds de beoordelingsronde van 21-09-2026, klaar voor collega-test; de oorspronkelijke reden verwees naar een aandachtspunt in TOOLS.md dat niet meer bestaat. Bijgewerkt op 01-10-2026. Sindsdien gebouwd en getoetst: de Excel-export (27-09-2026), het tabblad Terugkeer uit de BV, de vrijval van een positieve terugkeerreserve bij staking (art. 3.54a lid 4 Wet IB 2001), een negatieve terugkeerreserve in beide routes en de omzetting van de oudedagsreserve via art. 10a.29 lid 12 Wet IB 2001, buiten de Zvw (art. 43 lid 2 onderdeel b Zvw). De weerleggingsronde van de eerste review is op 01-10-2026 afgerond: alle 28 bevindingen hebben een oordeel met vindplaats en de open bevindingen zijn hersteld. Bevestigd met Stcrt. 2025, 38606, dat de landbouwvrijstelling ook bij een waardedaling in de BV werkt. Tests gemeten op 01-10-2026: 1.883 in tests/fiscaal.test.mjs, 178 in tests/beoordeling.test.mjs en 35 in de overige testbestanden, alle geslaagd. De resterende punten, waaronder de jaarwaarden voor 2027, staan in OPENSTAAND.md van de bronrepo.",
      "repo": "bouwman-tools/BV-Ja_Nee",
      "access_app_id": "6bf2694f-c9db-4255-84ad-547e830908f9",
      "in_portal": true,
      "in_beheer": true,
      "eigenaar": "Sylvain Bouwman",
      "beoordelingsritme": "belastingplan",
      "laatst_beoordeeld": "2026-09-21",
      "jaarwaarden": [
        "TARIEVEN_2026",
        "gebruikelijkLoonNorm"
      ],
      "jaarwaarden_gecontroleerd": "2026-08-28",
      "uitgangen": {
        "dossierstuk": true,
        "excel": true,
        "dossierbestand": true
      }
    },
    {
      "id": "sjablonen-dga",
      "naam": "Sjablonen DGA",
      "beschrijving": "Genereert de juridische documenten voor de inrichting van een holdingstructuur voor een DGA",
      "bestand": "join-bv-documenten.html",
      "categorie": "BV & DGA",
      "icon": "📄",
      "tags": [
        {
          "label": "BV"
        },
        {
          "label": "DGA"
        },
        {
          "label": "Lokaal",
          "soort": "privacy-local"
        }
      ],
      "status": "live",
      "status_reden": "De fiscale onderbouwing is op 05-10-2026 nagelezen (art. 2:238 en 2:239 BW, art. 10a lid 7 Wet LB, grondslag KvK-nummer, normbedrag gebruikelijk loon 2026) en de vragen over de fiscale eenheid zijn besloten. De juridische modelteksten zijn niet extern beoordeeld (besluit Sylvain 05-10-2026); zie OPENSTAAND.md van Sjablonen-DGA.",
      "repo": "bouwman-tools/Sjablonen-DGA",
      "uc": "UC01",
      "access_app_id": "221ef623-dadc-4421-be69-efe6ee3c774f",
      "in_portal": true,
      "in_beheer": true,
      "eigenaar": "Sylvain Bouwman",
      "beoordelingsritme": "belastingplan",
      "laatst_beoordeeld": null,
      "fiscaal_oordeel": false,
      "jaarwaarden": [
        "FISCAAL_PER_JAAR"
      ],
      "jaarwaarden_gecontroleerd": "2026-08-28",
      "uitgangen": {
        "dossierstuk": false,
        "excel": false,
        "dossierbestand": false
      }
    },
    {
      "id": "rekeningcourant-dividend",
      "naam": "Rekeningcourant + Dividend",
      "beschrijving": "Berekent de optimale aflossingsroute van een rekening-courantschuld van een DGA",
      "bestand": "rc-schuld-dga.html",
      "categorie": "BV & DGA",
      "icon": "💰",
      "tags": [
        {
          "label": "BV"
        },
        {
          "label": "DGA"
        },
        {
          "label": "Lokaal",
          "soort": "privacy-local"
        }
      ],
      "status": "live",
      "status_reden": "Jaarwaarden op 06-09-2026 door de eigenaar beoordeeld, vastgelegd in het register op 08-09-2026. Op 09-09-2026 is de verliesverrekening in de routeplanner hersteld (vrijgave-Rekeningcourant-met-dividend-2026-09-09.md); de drie beoordelingsvragen daarbij (het moment van de teruggaaf, het verlies buiten de horizon en de aanname over herinzet van de teruggaaf) stonden op dat moment nog open.",
      "repo": "bouwman-tools/Rekeningcourant-met-dividend",
      "access_app_id": "287f71cc-2a57-473c-a23a-a9b79eb908f7",
      "in_portal": true,
      "in_beheer": true,
      "eigenaar": "Sylvain Bouwman",
      "beoordelingsritme": "belastingplan",
      "laatst_beoordeeld": "2026-09-09",
      "jaarwaarden": [
        "TAX_CONFIG"
      ],
      "jaarwaarden_gecontroleerd": "2026-09-08",
      "uitgangen": {
        "dossierstuk": true,
        "excel": false,
        "dossierbestand": false
      }
    },
    {
      "id": "herstructurering",
      "naam": "Herstructurering",
      "beschrijving": "Loopt herstructureringstrajecten stap voor stap langs en adviseert met AI",
      "bestand": "herstructurering-assistent-v3.html",
      "categorie": "BV & DGA",
      "icon": "🔄",
      "tags": [
        {
          "label": "BV"
        },
        {
          "label": "AI",
          "soort": "ai"
        },
        {
          "label": "Via Anthropic API",
          "soort": "privacy-ai"
        }
      ],
      "status": "concept",
      "status_reden": "Teruggezet van live naar concept op 19-09-2026, op besluit van Sylvain. De verkenning van 08-09-2026 (nu OPENSTAAND.md) omschrijft de tool als een intake met checklist, statische uitleg en een werkende kennisgroepenkoppeling, zonder rekenkern of beslisregels. Zij trof daarbij drie fiscale onjuistheden in de vaste tekst, rekenfouten in de voorbeeldberekeningen en acht aanvinkvakjes die door een dubbele klikafhandeling niet werken. Nagemeten op 19-09-2026: die onjuistheden staan er nog, er is geen testset en er staat geen voorbehoud in het scherm. Het werk ligt sinds 11-09-2026 stil in afwachting van een fiscalist die een nieuwe opzet beoordeelt.",
      "repo": "bouwman-tools/Herstructurering",
      "access_app_id": "7f21b48f-27eb-4609-b6c7-ea860acdd85b",
      "in_portal": true,
      "in_beheer": true,
      "eigenaar": "Sylvain Bouwman",
      "beoordelingsritme": "jaarlijks",
      "laatst_beoordeeld": null,
      "fiscaal_oordeel": false,
      "jaarwaarden": [],
      "jaarwaarden_gecontroleerd": null,
      "uitgangen": {
        "dossierstuk": false,
        "excel": false,
        "dossierbestand": false
      }
    },
    {
      "id": "gebruikelijk-loon",
      "naam": "Gebruikelijk loon",
      "beschrijving": "Toetst het DGA-loon aan de wettelijke norm: vergelijkingsloon, hoogste werknemer en afroommethode",
      "bestand": "gebruikelijk-loon.html",
      "categorie": "BV & DGA",
      "icon": "💶",
      "tags": [
        {
          "label": "BV"
        },
        {
          "label": "DGA"
        },
        {
          "label": "Lokaal",
          "soort": "privacy-local"
        }
      ],
      "status": "live",